{
  "farhp_weblab_study_version": "0.7",
  "session_id": "FARHP-DEPLOY-TEST-P-BROWSER-01-424242-1785469276364",
  "study_id": "FARHP-DEPLOY-TEST",
  "participant_id": "P-BROWSER-01",
  "created_at": "2026-07-31T03:41:16.364Z",
  "completed_at": "2026-07-31T03:41:16.941Z",
  "task": "multi_stimulus_ABX_identity_match",
  "plan_fingerprint": {
    "algorithm": "FNV32x8-fallback",
    "value": "b6c3a1c3afb3d45e27bb255514dd9f386c18ab0fd21a5eeab72e05711a359444"
  },
  "plan": {
    "farhp_weblab_plan_version": "0.7",
    "study_id": "FARHP-DEPLOY-TEST",
    "task": "multi_stimulus_ABX_identity_match",
    "planned_sample_size": 12,
    "primary_endpoint": "abx_accuracy_vs_0_5",
    "preregistration_note": "Primary endpoint fixed before collection.",
    "design": {
      "selected_stimuli": [
        "nihao",
        "nihaoma"
      ],
      "altered_condition": "zero",
      "intervention_strength": 0.75,
      "repeats_per_stimulus": 1,
      "practice_trials": 1,
      "break_every_main_trials": 1,
      "seed": 424242,
      "ordering": "participant_indexed_latin_or_cyclic_order_plus_balanced_ABX_cells",
      "blinding": "formal-trial A/B mapping and correctness hidden until completion"
    },
    "exclusion_policy": {
      "min_rt_ms": 150,
      "max_rt_ms": 30000,
      "min_completion_ratio": 1,
      "min_valid_trial_ratio": 0.8,
      "min_plays_each_label": 1,
      "accuracy_based_exclusion": false
    },
    "status": "locked",
    "created_at": "2026-07-31T03:41:12.881Z",
    "locked_at": "2026-07-31T03:41:14.943Z",
    "plan_fingerprint": {
      "algorithm": "FNV32x8-fallback",
      "value": "b6c3a1c3afb3d45e27bb255514dd9f386c18ab0fd21a5eeab72e05711a359444"
    }
  },
  "exclusion_policy": {
    "min_rt_ms": 150,
    "max_rt_ms": 30000,
    "min_completion_ratio": 1,
    "min_valid_trial_ratio": 0.8,
    "min_plays_each_label": 1,
    "accuracy_based_exclusion": false
  },
  "setup": {
    "seed": 424242,
    "repeats_per_stimulus": 1,
    "practice_trials": 1,
    "break_every_main_trials": 1,
    "selected_stimuli": [
      "nihao",
      "nihaoma"
    ],
    "participant_latin_row": 0,
    "ordering_method": "participant_indexed_mirrored_latin_row",
    "baseline_condition": "current_utterance_farhp",
    "altered_condition": "zero",
    "altered_condition_label": "零相位",
    "intervention_strength": 0.75,
    "randomization": "balanced_ABX_cells_plus_participant_indexed_stimulus_order",
    "blinding": "formal-trial A/B mapping and correctness hidden until completion"
  },
  "invariant_certificates": [
    {
      "stimulus_key": "nihao",
      "same_sample_count": true,
      "same_duration": true,
      "max_f0_track_difference_hz": 0,
      "same_lexical_bopomofo": true,
      "same_surface_bopomofo": true,
      "waveform_rms_difference": 0.18470875542725443,
      "pass": true
    },
    {
      "stimulus_key": "nihaoma",
      "same_sample_count": true,
      "same_duration": true,
      "max_f0_track_difference_hz": 0,
      "same_lexical_bopomofo": true,
      "same_surface_bopomofo": true,
      "waveform_rms_difference": 0.17877751648540796,
      "pass": true
    }
  ],
  "stimuli": [
    {
      "stimulus_key": "nihao",
      "label": "你好",
      "bopomofo": "ㄋㄧˇ ㄏㄠˇ",
      "duration_seconds": 0.08216666666666667,
      "source_utterance": {
        "farhp_weblab_utterance_version": "0.6",
        "generated_at": "2026-07-31T03:41:16.775Z",
        "sample_rate_hz": 24000,
        "text": "你好",
        "sentence_type": "declarative",
        "lexical_bopomofo": [
          "ㄋㄧˇ",
          "ㄏㄠˇ"
        ],
        "surface_bopomofo": [
          "ㄋㄧˊ",
          "ㄏㄠˇ"
        ],
        "rules": {
          "third_tone_sandhi": true,
          "yi_bu_sandhi": true,
          "neutral_tone_context": true,
          "prosodic_grouping": true,
          "coarticulation_crossfade": true,
          "formant_parameter_interpolation": true,
          "phrase_declination": true,
          "sentence_intonation": "declarative",
          "intonation_strength": 1,
          "speech_rate": 2.1,
          "boundary_overlap_ms": 32,
          "group_pause_ms": 90,
          "final_lengthening": 0.18
        },
        "prosodic_groups": [],
        "syllables": [
          {
            "index": 0,
            "character": "你",
            "initial": "ㄋ",
            "final": "i",
            "lexical_tone": 3,
            "surface_tone": 2,
            "lexical_bopomofo": "ㄋㄧˇ",
            "surface_bopomofo": "ㄋㄧˊ",
            "sandhi_applied": true,
            "sandhi_types": [
              "三聲變調"
            ],
            "third_tone_sandhi": true,
            "yi_bu_sandhi": false,
            "prosodic_group": 0,
            "boundary_after": false,
            "contextual_neutral": false,
            "previous_surface_tone": null,
            "base_f0_hz": 132,
            "duration_sec": 0.05238095238095238,
            "sentence_intonation_semitones": {
              "start": 0,
              "end": 0
            },
            "vocal_tract_context": {
              "left_vowel": null,
              "right_vowel": "a",
              "interpolation_strength": 0.62
            },
            "farhp": {
              "source": "lab",
              "strength": 1
            },
            "boundary": {
              "index": 0,
              "start_sample": 0,
              "end_sample": 1257,
              "overlap_samples": 0,
              "pause_before_samples": 0
            }
          },
          {
            "index": 1,
            "character": "好",
            "initial": "ㄏ",
            "final": "ao",
            "lexical_tone": 3,
            "surface_tone": 3,
            "lexical_bopomofo": "ㄏㄠˇ",
            "surface_bopomofo": "ㄏㄠˇ",
            "sandhi_applied": false,
            "sandhi_types": [],
            "third_tone_sandhi": false,
            "yi_bu_sandhi": false,
            "prosodic_group": 0,
            "boundary_after": false,
            "contextual_neutral": false,
            "previous_surface_tone": null,
            "base_f0_hz": 118.96506106462958,
            "duration_sec": 0.06180952380952381,
            "sentence_intonation_semitones": {
              "start": 0,
              "end": -0.7
            },
            "vocal_tract_context": {
              "left_vowel": "i",
              "right_vowel": null,
              "interpolation_strength": 0.62
            },
            "farhp": {
              "source": "lab",
              "strength": 1
            },
            "boundary": {
              "index": 1,
              "start_sample": 489,
              "end_sample": 1972,
              "overlap_samples": 768,
              "pause_before_samples": 0
            }
          }
        ],
        "acoustics": {
          "duration_sec": 0.08216666666666667,
          "f0_min_hz": 82.15190887451172,
          "f0_max_hz": 138.39913940429688,
          "raw_peak": 0.796454668045044
        },
        "decomposition": "lexical phonology -> prosodic grouping -> tone sandhi -> contextual neutral tone -> phrase/sentence intonation -> vocal-tract interpolation -> syllable FARHP -> boundary rendering",
        "warning": "MVP prosody and formant-interpolation model; not a natural-speech TTS or full syntactic/physiological parser"
      },
      "invariant_certificate": {
        "stimulus_key": "nihao",
        "same_sample_count": true,
        "same_duration": true,
        "max_f0_track_difference_hz": 0,
        "same_lexical_bopomofo": true,
        "same_surface_bopomofo": true,
        "waveform_rms_difference": 0.18470875542725443,
        "pass": true
      }
    },
    {
      "stimulus_key": "nihaoma",
      "label": "你好嗎",
      "bopomofo": "ㄋㄧˇ ㄏㄠˇ ˙ㄇㄚ",
      "duration_seconds": 0.07279166666666667,
      "source_utterance": {
        "farhp_weblab_utterance_version": "0.6",
        "generated_at": "2026-07-31T03:41:16.855Z",
        "sample_rate_hz": 24000,
        "text": "你好嗎",
        "sentence_type": "question",
        "lexical_bopomofo": [
          "ㄋㄧˇ",
          "ㄏㄠˇ",
          "˙ㄇㄚ"
        ],
        "surface_bopomofo": [
          "ㄋㄧˊ",
          "ㄏㄠˇ",
          "˙ㄇㄚ"
        ],
        "rules": {
          "third_tone_sandhi": true,
          "yi_bu_sandhi": true,
          "neutral_tone_context": true,
          "prosodic_grouping": true,
          "coarticulation_crossfade": true,
          "formant_parameter_interpolation": true,
          "phrase_declination": true,
          "sentence_intonation": "question",
          "intonation_strength": 1,
          "speech_rate": 2.1,
          "boundary_overlap_ms": 32,
          "group_pause_ms": 90,
          "final_lengthening": 0.18
        },
        "prosodic_groups": [],
        "syllables": [
          {
            "index": 0,
            "character": "你",
            "initial": "ㄋ",
            "final": "i",
            "lexical_tone": 3,
            "surface_tone": 2,
            "lexical_bopomofo": "ㄋㄧˇ",
            "surface_bopomofo": "ㄋㄧˊ",
            "sandhi_applied": true,
            "sandhi_types": [
              "三聲變調"
            ],
            "third_tone_sandhi": true,
            "yi_bu_sandhi": false,
            "prosodic_group": 0,
            "boundary_after": false,
            "contextual_neutral": false,
            "previous_surface_tone": null,
            "base_f0_hz": 132,
            "duration_sec": 0.05238095238095238,
            "sentence_intonation_semitones": {
              "start": 0,
              "end": 0
            },
            "vocal_tract_context": {
              "left_vowel": null,
              "right_vowel": "a",
              "interpolation_strength": 0.62
            },
            "farhp": {
              "source": "lab",
              "strength": 1
            },
            "boundary": {
              "index": 0,
              "start_sample": 0,
              "end_sample": 1257,